<?xml version="1.0" encoding="UTF-8"?>
<book xmlns:xsi="http://www.w3.org/2001/XMLSchema-instance" xsi:noNamespaceSchemaLocation="file:///D:/Work/WebServices/Master/WS20170614/Xml/Xsd/book.xsd">
	<isbn>isbn03</isbn>
	<title>let us c</title>
	<author>		
		<name>yaswanth</name>		
		<dob>2016-01-01</dob>
	</author>
	<publisher>
		<name>Wrox</name>
		<est-dt>1998-01-01</est-dt>
	</publisher>
</book>
